{
  "files": [
    {
      "id": "1767369973553-2rf5662",
      "originalName": "2 files",
      "displayName": "Therapy bills 2025",
      "fileType": "healthcare",
      "importedAt": "2026-01-02T16:06:13.566Z",
      "filePath": "1767369973553-2rf5662.txt",
      "sourceFiles": [
        {
          "id": "1767369973557-8k0fm1w",
          "originalName": "Superbill20251130-605200-z7c6vk.pdf",
          "filePath": "1767369973557-8k0fm1w.txt",
          "mimeType": "application/pdf",
          "addedAt": "2026-01-02T16:06:13.560Z"
        },
        {
          "id": "1767369973561-pqrs09m",
          "originalName": "Superbill20251204-838-5fvyd0.pdf",
          "filePath": "1767369973561-pqrs09m.txt",
          "mimeType": "application/pdf",
          "addedAt": "2026-01-02T16:06:13.563Z"
        },
        {
          "id": "1767370569838-yees0rq",
          "originalName": "Superbill20251030-46394-rpqfkf.pdf",
          "filePath": "1767370569838-yees0rq.txt",
          "mimeType": "application/pdf",
          "addedAt": "2026-01-02T16:16:09.841Z"
        },
        {
          "id": "1767370581507-hsfg9ak",
          "originalName": "Superbill20251031-140107-x7uklg.pdf",
          "filePath": "1767370581507-hsfg9ak.txt",
          "mimeType": "application/pdf",
          "addedAt": "2026-01-02T16:16:21.509Z"
        },
        {
          "id": "1767372216180-q89a9sg",
          "originalName": "Superbill20250701-13923-ethkk8.pdf",
          "filePath": "1767372216180-q89a9sg.txt",
          "mimeType": "application/pdf",
          "addedAt": "2026-01-02T16:43:36.182Z"
        },
        {
          "id": "1767372229604-78sassn",
          "originalName": "Superbill20251001-789-46qyir.pdf",
          "filePath": "1767372229604-78sassn.txt",
          "mimeType": "application/pdf",
          "addedAt": "2026-01-02T16:43:49.607Z"
        },
        {
          "id": "1767372241779-k6bzrcm",
          "originalName": "Superbill20251105-32637-9obo7o.pdf",
          "filePath": "1767372241779-k6bzrcm.txt",
          "mimeType": "application/pdf",
          "addedAt": "2026-01-02T16:44:01.781Z"
        },
        {
          "id": "1767372254453-siolqlg",
          "originalName": "Superbill20251205-1067-gpctw8.pdf",
          "filePath": "1767372254453-siolqlg.txt",
          "mimeType": "application/pdf",
          "addedAt": "2026-01-02T16:44:14.454Z"
        },
        {
          "id": "1767402242796-e3mhp2m",
          "originalName": "Superbill20250601_264217_4xmti9.pdf",
          "filePath": "1767402242796-e3mhp2m.txt",
          "mimeType": "application/pdf",
          "addedAt": "2026-01-03T01:04:02.799Z"
        },
        {
          "id": "1767402254632-3zrcheo",
          "originalName": "Superbill20250701_260158_qkn1tc.pdf",
          "filePath": "1767402254632-3zrcheo.txt",
          "mimeType": "application/pdf",
          "addedAt": "2026-01-03T01:04:14.634Z"
        },
        {
          "id": "1767402265903-zlceuaq",
          "originalName": "Superbill20250801-95102-wd3bl3.pdf",
          "filePath": "1767402265903-zlceuaq.txt",
          "mimeType": "application/pdf",
          "addedAt": "2026-01-03T01:04:25.909Z"
        },
        {
          "id": "1767402276386-31spgro",
          "originalName": "Superbill20250831-497626-qgjp16.pdf",
          "filePath": "1767402276386-31spgro.txt",
          "mimeType": "application/pdf",
          "addedAt": "2026-01-03T01:04:36.389Z"
        },
        {
          "id": "1767402286330-cf8qhmi",
          "originalName": "Superbill20250930-178719-cg3fj5.pdf",
          "filePath": "1767402286330-cf8qhmi.txt",
          "mimeType": "application/pdf",
          "addedAt": "2026-01-03T01:04:46.335Z"
        }
      ],
      "visualization": "<div style=\"font-family: 'Segoe UI', Tahoma, Geneva, Verdana, sans-serif; max-width: 1200px; margin: 0 auto; padding: 2rem; background: #fafbfc; min-height: 100vh;\">\n  <header style=\"text-align: center; margin-bottom: 1.5rem;\">\n    <h1 style=\"color: #374151; margin: 0; font-size: 1.8rem; font-weight: 600;\">Therapy Bills 2025</h1>\n    <p style=\"color: #6b7280; margin: 0.5rem 0 0 0; font-size: 0.9rem;\">May - December 2025</p>\n  </header>\n\n  <!-- Summary Cards -->\n  <div style=\"display: grid; grid-template-columns: repeat(auto-fit, minmax(120px, 1fr)); gap: 0.8rem; margin-bottom: 1.5rem;\">\n    <div style=\"background: white; padding: 0.6rem; border-radius: 8px; box-shadow: 0 1px 3px rgba(0,0,0,0.08); border-left: 3px solid #6b7280;\">\n      <h3 style=\"margin: 0 0 0.2rem 0; color: #374151; font-size: 0.7rem; font-weight: 500;\">Total Statements</h3>\n      <p style=\"margin: 0; font-size: 1.1rem; font-weight: 600; color: #6b7280;\">16</p>\n    </div>\n    <div style=\"background: white; padding: 0.6rem; border-radius: 8px; box-shadow: 0 1px 3px rgba(0,0,0,0.08); border-left: 3px solid #4f46e5;\">\n      <h3 style=\"margin: 0 0 0.2rem 0; color: #374151; font-size: 0.7rem; font-weight: 500;\">Total Amount</h3>\n      <p style=\"margin: 0; font-size: 1.1rem; font-weight: 600; color: #4f46e5;\">$12,685</p>\n    </div>\n    <div style=\"background: white; padding: 0.6rem; border-radius: 8px; box-shadow: 0 1px 3px rgba(0,0,0,0.08); border-left: 3px solid #059669;\">\n      <h3 style=\"margin: 0 0 0.2rem 0; color: #374151; font-size: 0.7rem; font-weight: 500;\">Total Sessions</h3>\n      <p style=\"margin: 0; font-size: 1.1rem; font-weight: 600; color: #059669;\">40</p>\n    </div>\n  </div>\n\n  <!-- Cost Breakdown by Provider -->\n  <div style=\"background: white; border-radius: 8px; box-shadow: 0 1px 3px rgba(0,0,0,0.08); padding: 1.5rem; margin-bottom: 2rem;\">\n    <h2 style=\"margin: 0 0 1.5rem 0; color: #374151; font-size: 1.2rem; font-weight: 600;\">Cost Breakdown by Provider</h2>\n    \n    <div style=\"display: flex; flex-direction: column; gap: 1rem;\">\n      <!-- Heather Mayone -->\n      <div>\n        <div style=\"display: flex; justify-content: space-between; align-items: center; margin-bottom: 0.5rem;\">\n          <span style=\"font-weight: 500; color: #374151; font-size: 0.9rem;\">Heather Mayone LCAT</span>\n          <span style=\"font-weight: 600; color: #374151; font-size: 0.9rem;\">$7,100 (22 sessions)</span>\n        </div>\n        <div style=\"background: #f3f4f6; height: 10px; border-radius: 5px; overflow: hidden;\">\n          <div style=\"background: linear-gradient(90deg, #6366f1, #8b5cf6); height: 100%; width: 56%; border-radius: 5px; transition: width 0.3s ease;\"></div>\n        </div>\n      </div>\n      \n      <!-- Dr. Emma Kolpon -->\n      <div>\n        <div style=\"display: flex; justify-content: space-between; align-items: center; margin-bottom: 0.5rem;\">\n          <span style=\"font-weight: 500; color: #374151; font-size: 0.9rem;\">Dr. Emma Kolpon</span>\n          <span style=\"font-weight: 600; color: #374151; font-size: 0.9rem;\">$2,120 (8 sessions)</span>\n        </div>\n        <div style=\"background: #f3f4f6; height: 10px; border-radius: 5px; overflow: hidden;\">\n          <div style=\"background: linear-gradient(90deg, #0891b2, #06b6d4); height: 100%; width: 17%; border-radius: 5px; transition: width 0.3s ease;\"></div>\n        </div>\n      </div>\n\n      <!-- Renee Wolk -->\n      <div>\n        <div style=\"display: flex; justify-content: space-between; align-items: center; margin-bottom: 0.5rem;\">\n          <span style=\"font-weight: 500; color: #374151; font-size: 0.9rem;\">Renee Wolk, Ph.D.</span>\n          <span style=\"font-weight: 600; color: #374151; font-size: 0.9rem;\">$1,400 (4 sessions)</span>\n        </div>\n        <div style=\"background: #f3f4f6; height: 10px; border-radius: 5px; overflow: hidden;\">\n          <div style=\"background: linear-gradient(90deg, #dc2626, #ef4444); height: 100%; width: 11%; border-radius: 5px; transition: width 0.3s ease;\"></div>\n        </div>\n      </div>\n    </div>\n    \n    <div style=\"margin-top: 1.2rem; padding-top: 1rem; border-top: 1px solid #e5e7eb;\">\n      <div style=\"display: flex; justify-content: space-between; align-items: center;\">\n        <span style=\"font-weight: 600; color: #374151; font-size: 1rem;\">Total</span>\n        <span style=\"font-weight: 700; color: #6366f1; font-size: 1.1rem;\">$12,620</span>\n      </div>\n    </div>\n  </div>\n\n  <!-- Visits Table -->\n  <div style=\"background: white; border-radius: 8px; box-shadow: 0 1px 3px rgba(0,0,0,0.08); overflow: hidden;\">\n    <div style=\"background: #f8fafc; border-bottom: 1px solid #e5e7eb; padding: 1.2rem;\">\n      <h2 style=\"margin: 0; font-size: 1.2rem; color: #374151; font-weight: 600;\">Healthcare Visits</h2>\n      <p style=\"margin: 0.5rem 0 0 0; color: #6b7280; font-size: 0.85rem;\">Click on any row to view detailed information</p>\n    </div>\n    \n    <div style=\"overflow-x: auto;\">\n      <table id=\"visitsTable\" style=\"width: 100%; border-collapse: collapse;\">\n        <thead>\n          <tr style=\"background: #f8fafc; border-bottom: 2px solid #e5e7eb;\">\n            <th onclick=\"sortTable(0)\" style=\"padding: 0.8rem; text-align: left; cursor: pointer; color: #475569; font-weight: 600; user-select: none; position: relative; font-size: 0.85rem; transition: background-color 0.2s;\" onmouseover=\"this.style.backgroundColor='#f1f5f9'\" onmouseout=\"this.style.backgroundColor='#f8fafc'\">\n              Month <span id=\"sort-arrow-0\" style=\"position: absolute; right: 0.5rem; opacity: 0.4; font-size: 0.8rem;\">↕</span>\n            </th>\n            <th onclick=\"sortTable(1)\" style=\"padding: 0.8rem; text-align: left; cursor: pointer; color: #475569; font-weight: 600; user-select: none; position: relative; font-size: 0.85rem; transition: background-color 0.2s;\" onmouseover=\"this.style.backgroundColor='#f1f5f9'\" onmouseout=\"this.style.backgroundColor='#f8fafc'\">\n              Date <span id=\"sort-arrow-1\" style=\"position: absolute; right: 0.5rem; opacity: 0.4; font-size: 0.8rem;\">↕</span>\n            </th>\n            <th onclick=\"sortTable(2)\" style=\"padding: 0.8rem; text-align: left; cursor: pointer; color: #475569; font-weight: 600; user-select: none; position: relative; font-size: 0.85rem; transition: background-color 0.2s;\" onmouseover=\"this.style.backgroundColor='#f1f5f9'\" onmouseout=\"this.style.backgroundColor='#f8fafc'\">\n              Provider <span id=\"sort-arrow-2\" style=\"position: absolute; right: 0.5rem; opacity: 0.4; font-size: 0.8rem;\">↕</span>\n            </th>\n            <th style=\"padding: 0.8rem; text-align: left; color: #475569; font-weight: 600; font-size: 0.85rem;\">Patient</th>\n            <th style=\"padding: 0.8rem; text-align: left; color: #475569; font-weight: 600; font-size: 0.85rem;\">Service Code</th>\n            <th style=\"padding: 0.8rem; text-align: left; color: #475569; font-weight: 600; font-size: 0.85rem;\">Diagnosis</th>\n            <th style=\"padding: 0.8rem; text-align: right; color: #475569; font-weight: 600; font-size: 0.85rem;\">Amount</th>\n          </tr>\n        </thead>\n        <tbody id=\"tableBody\">\n          <!-- Content will be populated by JavaScript -->\n        </tbody>\n      </table>\n    </div>\n  </div>\n\n  <!-- Modal Overlay -->\n  <div id=\"modalOverlay\" style=\"display: none; position: fixed; top: 0; left: 0; width: 100%; height: 100%; background: rgba(55, 65, 81, 0.5); z-index: 1000; backdrop-filter: blur(2px);\" onclick=\"closeModal()\"></div>\n\n  <!-- Modal Content -->\n  <div id=\"visitModal\" style=\"display: none; position: fixed; top: 50%; left: 50%; transform: translate(-50%, -50%); background: white; border-radius: 8px; box-shadow: 0 10px 25px rgba(0,0,0,0.15); z-index: 1001; max-width: 600px; width: 90%; max-height: 90vh; overflow-y: auto;\">\n    <div id=\"modalContent\">\n      <!-- Content will be populated by JavaScript -->\n    </div>\n  </div>\n\n  <script>\n    const visits = [\n      // May 2025 visits - Heather Mayone\n      {\n        month: \"May 2025\",\n        date: \"05/07/2025\",\n        sortDate: \"2025-05-07\",\n        provider: \"Heather Mayone LCAT\",\n        patient: \"Amit\",\n        serviceCode: \"90834\",\n        diagnosisCode: \"F41.1\",\n        amount: 300,\n        details: {\n          provider: \"Heather Mayone LCAT LLC\",\n          npi: \"1760716013\",\n          phone: \"(646) 820-3307\",\n          email: \"heathermayonelcat@gmail.com\",\n          license: \"LCAT #001243\",\n          address: \"150 W 28th Street, Suite 1404, New York, NY 10001-6103\",\n          patient: \"Amit Bhattacharyya\",\n          dob: \"12/02/1970\",\n          serviceType: \"In-Person\",\n          description: \"Psychotherapy, 45 min\",\n          diagnosis: \"F41.1 - Generalized anxiety disorder\",\n          statementNum: \"#0399\",\n          fee: \"$300\"\n        }\n      },\n      {\n        month: \"May 2025\",\n        date: \"05/14/2025\",\n        sortDate: \"2025-05-14\",\n        provider: \"Heather Mayone LCAT\",\n        patient: \"Amit\",\n        serviceCode: \"90834\",\n        diagnosisCode: \"F41.1\",\n        amount: 300,\n        details: {\n          provider: \"Heather Mayone LCAT LLC\",\n          npi: \"1760716013\",\n          phone: \"(646) 820-3307\",\n          email: \"heathermayonelcat@gmail.com\",\n          license: \"LCAT #001243\",\n          address: \"150 W 28th Street, Suite 1404, New York, NY 10001-6103\",\n          patient: \"Amit Bhattacharyya\",\n          dob: \"12/02/1970\",\n          serviceType: \"In-Person\",\n          description: \"Psychotherapy, 45 min\",\n          diagnosis: \"F41.1 - Generalized anxiety disorder\",\n          statementNum: \"#0399\",\n          fee: \"$300\"\n        }\n      },\n      {\n        month: \"May 2025\",\n        date: \"05/21/2025\",\n        sortDate: \"2025-05-21\",\n        provider: \"Heather Mayone LCAT\",\n        patient: \"Amit\",\n        serviceCode: \"90834\",\n        diagnosisCode: \"F41.1\",\n        amount: 300,\n        details: {\n          provider: \"Heather Mayone LCAT LLC\",\n          npi: \"1760716013\",\n          phone: \"(646) 820-3307\",\n          email: \"heathermayonelcat@gmail.com\",\n          license: \"LCAT #001243\",\n          address: \"150 W 28th Street, Suite 1404, New York, NY 10001-6103\",\n          patient: \"Amit Bhattacharyya\",\n          dob: \"12/02/1970\",\n          serviceType: \"In-Person\",\n          description: \"Psychotherapy, 45 min\",\n          diagnosis: \"F41.1 - Generalized anxiety disorder\",\n          statementNum: \"#0399\",\n          fee: \"$300\"\n        }\n      },\n      {\n        month: \"May 2025\",\n        date: \"05/28/2025\",\n        sortDate: \"2025-05-28\",\n        provider: \"Heather Mayone LCAT\",\n        patient: \"Amit\",\n        serviceCode: \"90834\",\n        diagnosisCode: \"F41.1\",\n        amount: 300,\n        details: {\n          provider: \"Heather Mayone LCAT LLC\",\n          npi: \"1760716013\",\n          phone: \"(646) 820-3307\",\n          email: \"heathermayonelcat@gmail.com\",\n          license: \"LCAT #001243\",\n          address: \"150 W 28th Street, Suite 1404, New York, NY 10001-6103\",\n          patient: \"Amit Bhattacharyya\",\n          dob: \"12/02/1970\",\n          serviceType: \"In-Person\",\n          description: \"Psychotherapy, 45 min\",\n          diagnosis: \"F41.1 - Generalized anxiety disorder\",\n          statementNum: \"#0399\",\n          fee: \"$300\"\n        }\n      },\n      // June 2025 visits\n      {\n        month: \"Jun 2025\",\n        date: \"06/04/2025\",\n        sortDate: \"2025-06-04\",\n        provider: \"Dr. Emma Kolpon\",\n        patient: \"Anika\",\n        serviceCode: \"90834\",\n        diagnosisCode: \"F41.1\",\n        amount: 265,\n        details: {\n          provider: \"Dr. Emma Kolpon\",\n          npi: \"1265071757\",\n          phone: \"(917) 796-0881\",\n          email: \"dremmakolpon@gmail.com\",\n          license: \"Psy. D. #023452\",\n          address: \"1889 Palmer Ave, Larchmont, NY 10538-3055\",\n          patient: \"Anika Bhattacharyya\",\n          dob: \"04/02/2007\",\n          serviceType: \"In-Person\",\n          description: \"Individual Psychotherapy, 45 min\",\n          diagnosis: \"F41.1 - Generalized anxiety disorder\",\n          statementNum: \"#0785\",\n          fee: \"$265\"\n        }\n      },\n      {\n        month: \"Jun 2025\",\n        date: \"06/04/2025\",\n        sortDate: \"2025-06-04\",\n        provider: \"Heather Mayone LCAT\",\n        patient: \"Amit\",\n        serviceCode: \"90834\",\n        diagnosisCode: \"F41.1\",\n        amount: 325,\n        details: {\n          provider: \"Heather Mayone LCAT LLC\",\n          npi: \"1760716013\",\n          phone: \"(646) 820-3307\",\n          email: \"heathermayonelcat@gmail.com\",\n          license: \"LCAT #001243\",\n          address: \"150 W 28th Street, Suite 1404, New York, NY 10001-6103\",\n          patient: \"Amit Bhattacharyya\",\n          dob: \"12/02/1970\",\n          serviceType: \"In-Person\",\n          description: \"Psychotherapy, 45 min\",\n          diagnosis: \"F41.1 - Generalized anxiety disorder\",\n          statementNum: \"#0424\",\n          fee: \"$325\"\n        }\n      },\n      {\n        month: \"Jun 2025\",\n        date: \"06/10/2025\",\n        sortDate: \"2025-06-10\",\n        provider: \"Heather Mayone LCAT\",\n        patient: \"Amit\",\n        serviceCode: \"90834\",\n        diagnosisCode: \"F41.1\",\n        amount: 325,\n        details: {\n          provider: \"Heather Mayone LCAT LLC\",\n          npi: \"1760716013\",\n          phone: \"(646) 820-3307\",\n          email: \"heathermayonelcat@gmail.com\",\n          license: \"LCAT #001243\",\n          address: \"150 W 28th Street, Suite 1404, New York, NY 10001-6103\",\n          patient: \"Amit Bhattacharyya\",\n          dob: \"12/02/1970\",\n          serviceType: \"In-Person\",\n          description: \"Psychotherapy, 45 min\",\n          diagnosis: \"F41.1 - Generalized anxiety disorder\",\n          statementNum: \"#0424\",\n          fee: \"$325\"\n        }\n      },\n      {\n        month: \"Jun 2025\",\n        date: \"06/17/2025\",\n        sortDate: \"2025-06-17\",\n        provider: \"Heather Mayone LCAT\",\n        patient: \"Amit\",\n        serviceCode: \"90834\",\n        diagnosisCode: \"F41.1\",\n        amount: 325,\n        details: {\n          provider: \"Heather Mayone LCAT LLC\",\n          npi: \"1760716013\",\n          phone: \"(646) 820-3307\",\n          email: \"heathermayonelcat@gmail.com\",\n          license: \"LCAT #001243\",\n          address: \"150 W 28th Street, Suite 1404, New York, NY 10001-6103\",\n          patient: \"Amit Bhattacharyya\",\n          dob: \"12/02/1970\",\n          serviceType: \"In-Person\",\n          description: \"Psychotherapy, 45 min\",\n          diagnosis: \"F41.1 - Generalized anxiety disorder\",\n          statementNum: \"#0424\",\n          fee: \"$325\"\n        }\n      },\n      {\n        month: \"Jun 2025\",\n        date: \"06/30/2025\",\n        sortDate: \"2025-06-30\",\n        provider: \"Heather Mayone LCAT\",\n        patient: \"Amit\",\n        serviceCode: \"90834\",\n        diagnosisCode: \"F41.1\",\n        amount: 325,\n        details: {\n          provider: \"Heather Mayone LCAT LLC\",\n          npi: \"1760716013\",\n          phone: \"(646) 820-3307\",\n          email: \"heathermayonelcat@gmail.com\",\n          license: \"LCAT #001243\",\n          address: \"150 W 28th Street, Suite 1404, New York, NY 10001-6103\",\n          patient: \"Amit Bhattacharyya\",\n          dob: \"12/02/1970\",\n          serviceType: \"In-Person\",\n          description: \"Psychotherapy, 45 min\",\n          diagnosis: \"F41.1 - Generalized anxiety disorder\",\n          statementNum: \"#0424\",\n          fee: \"$325\"\n        }\n      },\n      // July 2025 visits\n      {\n        month: \"Jul 2025\",\n        date: \"07/08/2025\",\n        sortDate: \"2025-07-08\",\n        provider: \"Heather Mayone LCAT\",\n        patient: \"Amit\",\n        serviceCode: \"90834\",\n        diagnosisCode: \"F41.1\",\n        amount: 325,\n        details: {\n          provider: \"Heather Mayone LCAT LLC\",\n          npi: \"1760716013\",\n          phone: \"(646) 820-3307\",\n          email: \"heathermayonelcat@gmail.com\",\n          license: \"LCAT #001243\",\n          address: \"150 W 28th Street, Suite 1404, New York, NY 10001-6103\",\n          patient: \"Amit Bhattacharyya\",\n          dob: \"12/02/1970\",\n          serviceType: \"In-Person\",\n          description: \"Psychotherapy, 45 min\",\n          diagnosis: \"F41.1 - Generalized anxiety disorder\",\n          statementNum: \"#0448\",\n          fee: \"$325\"\n        }\n      },\n      {\n        month: \"Jul 2025\",\n        date: \"07/15/2025\",\n        sortDate: \"2025-07-15\",\n        provider: \"Heather Mayone LCAT\",\n        patient: \"Amit\",\n        serviceCode: \"90834\",\n        diagnosisCode: \"F41.1\",\n        amount: 325,\n        details: {\n          provider: \"Heather Mayone LCAT LLC\",\n          npi: \"1760716013\",\n          phone: \"(646) 820-3307\",\n          email: \"heathermayonelcat@gmail.com\",\n          license: \"LCAT #001243\",\n          address: \"150 W 28th Street, Suite 1404, New York, NY 10001-6103\",\n          patient: \"Amit Bhattacharyya\",\n          dob: \"12/02/1970\",\n          serviceType: \"In-Person\",\n          description: \"Psychotherapy, 45 min\",\n          diagnosis: \"F41.1 - Generalized anxiety disorder\",\n          statementNum: \"#0448\",\n          fee: \"$325\"\n        }\n      },\n      {\n        month: \"Jul 2025\",\n        date: \"07/22/2025\",\n        sortDate: \"2025-07-22\",\n        provider: \"Heather Mayone LCAT\",\n        patient: \"Amit\",\n        serviceCode: \"90834\",\n        diagnosisCode: \"F41.1\",\n        amount: 325,\n        details: {\n          provider: \"Heather Mayone LCAT LLC\",\n          npi: \"1760716013\",\n          phone: \"(646) 820-3307\",\n          email: \"heathermayonelcat@gmail.com\",\n          license: \"LCAT #001243\",\n          address: \"150 W 28th Street, Suite 1404, New York, NY 10001-6103\",\n          patient: \"Amit Bhattacharyya\",\n          dob: \"12/02/1970\",\n          serviceType: \"In-Person\",\n          description: \"Psychotherapy, 45 min\",\n          diagnosis: \"F41.1 - Generalized anxiety disorder\",\n          statementNum: \"#0448\",\n          fee: \"$325\"\n        }\n      },\n      // August 2025 visits\n      {\n        month: \"Aug 2025\",\n        date: \"08/12/2025\",\n        sortDate: \"2025-08-12\",\n        provider: \"Heather Mayone LCAT\",\n        patient: \"Amit\",\n        serviceCode: \"90834\",\n        diagnosisCode: \"F41.1\",\n        amount: 325,\n        details: {\n          provider: \"Heather Mayone LCAT LLC\",\n          npi: \"1760716013\",\n          phone: \"(646) 820-3307\",\n          email: \"heathermayonelcat@gmail.com\",\n          license: \"LCAT #001243\",\n          address: \"150 W 28th Street, Suite 1404, New York, NY 10001-6103\",\n          patient: \"Amit Bhattacharyya\",\n          dob: \"12/02/1970\",\n          serviceType: \"In-Person\",\n          description: \"Psychotherapy, 45 min\",\n          diagnosis: \"F41.1 - Generalized anxiety disorder\",\n          statementNum: \"#0472\",\n          fee: \"$325\"\n        }\n      },\n      {\n        month: \"Aug 2025\",\n        date: \"08/19/2025\",\n        sortDate: \"2025-08-19\",\n        provider: \"Heather Mayone LCAT\",\n        patient: \"Amit\",\n        serviceCode: \"90834\",\n        diagnosisCode: \"F41.1\",\n        amount: 325,\n        details: {\n          provider: \"Heather Mayone LCAT LLC\",\n          npi: \"1760716013\",\n          phone: \"(646) 820-3307\",\n          email: \"heathermayonelcat@gmail.com\",\n          license: \"LCAT #001243\",\n          address: \"150 W 28th Street, Suite 1404, New York, NY 10001-6103\",\n          patient: \"Amit Bhattacharyya\",\n          dob: \"12/02/1970\",\n          serviceType: \"In-Person\",\n          description: \"Psychotherapy, 45 min\",\n          diagnosis: \"F41.1 - Generalized anxiety disorder\",\n          statementNum: \"#0472\",\n          fee: \"$325\"\n        }\n      },\n      // September 2025 visits\n      {\n        month: \"Sep 2025\",\n        date: \"09/02/2025\",\n        sortDate: \"2025-09-02\",\n        provider: \"Heather Mayone LCAT\",\n        patient: \"Amit\",\n        serviceCode: \"90834\",\n        diagnosisCode: \"F41.1\",\n        amount: 325,\n        details: {\n          provider: \"Heather Mayone LCAT LLC\",\n          npi: \"1760716013\",\n          phone: \"(646) 820-3307\",\n          email: \"heathermayonelcat@gmail.com\",\n          license: \"LCAT #001243\",\n          address: \"150 W 28th Street, Suite 1404, New York, NY 10001-6103\",\n          patient: \"Amit Bhattacharyya\",\n          dob: \"12/02/1970\",\n          serviceType: \"In-Person\",\n          description: \"Psychotherapy, 45 min\",\n          diagnosis: \"F41.1 - Generalized anxiety disorder\",\n          statementNum: \"#0496\",\n          fee: \"$325\"\n        }\n      },\n      {\n        month: \"Sep 2025\",\n        date: \"09/15/2025\",\n        sortDate: \"2025-09-15\",\n        provider: \"Dr. Emma Kolpon\",\n        patient: \"Anika\",\n        serviceCode: \"90834-95\",\n        diagnosisCode: \"F41.1\",\n        amount: 265,\n        details: {\n          provider: \"Dr. Emma Kolpon\",\n          npi: \"1265071757\",\n          phone: \"(917) 796-0881\",\n          email: \"dremmakolpon@gmail.com\",\n          license: \"Psy. D. #023452\",\n          address: \"1889 Palmer Ave, Larchmont, NY 10538-3055\",\n          patient: \"Anika Bhattacharyya\",\n          dob: \"04/02/2007\",\n          serviceType: \"Telehealth\",\n          description: \"Individual Psychotherapy, 45 min\",\n          diagnosis: \"F41.1 - Generalized anxiety disorder\",\n          statementNum: \"#0801\",\n          fee: \"$265\"\n        }\n      },\n      {\n        month: \"Sep 2025\",\n        date: \"09/22/2025\",\n        sortDate: \"2025-09-22\",\n        provider: \"Dr. Emma Kolpon\",\n        patient: \"Anika\",\n        serviceCode: \"90834-95\",\n        diagnosisCode: \"F41.1\",\n        amount: 265,\n        details: {\n          provider: \"Dr. Emma Kolpon\",\n          npi: \"1265071757\",\n          phone: \"(917) 796-0881\",\n          email: \"dremmakolpon@gmail.com\",\n          license: \"Psy. D. #023452\",\n          address: \"1889 Palmer Ave, Larchmont, NY 10538-3055\",\n          patient: \"Anika Bhattacharyya\",\n          dob: \"04/02/2007\",\n          serviceType: \"Telehealth\",\n          description: \"Individual Psychotherapy, 45 min\",\n          diagnosis: \"F41.1 - Generalized anxiety disorder\",\n          statementNum: \"#0801\",\n          fee: \"$265\"\n        }\n      },\n      {\n        month: \"Sep 2025\",\n        date: \"09/29/2025\",\n        sortDate: \"2025-09-29\",\n        provider: \"Dr. Emma Kolpon\",\n        patient: \"Anika\",\n        serviceCode: \"90834-95\",\n        diagnosisCode: \"F41.1\",\n        amount: 265,\n        details: {\n          provider: \"Dr. Emma Kolpon\",\n          npi: \"1265071757\",\n          phone: \"(917) 796-0881\",\n          email: \"dremmakolpon@gmail.com\",\n          license: \"Psy. D. #023452\",\n          address: \"1889 Palmer Ave, Larchmont, NY 10538-3055\",\n          patient: \"Anika Bhattacharyya\",\n          dob: \"04/02/2007\",\n          serviceType: \"Telehealth\",\n          description: \"Individual Psychotherapy, 45 min\",\n          diagnosis: \"F41.1 - Generalized anxiety disorder\",\n          statementNum: \"#0801\",\n          fee: \"$265\"\n        }\n      },\n      {\n        month: \"Sep 2025\",\n        date: \"09/30/2025\",\n        sortDate: \"2025-09-30\",\n        provider: \"Heather Mayone LCAT\",\n        patient: \"Amit\",\n        serviceCode: \"90834\",\n        diagnosisCode: \"F41.1\",\n        amount: 325,\n        details: {\n          provider: \"Heather Mayone LCAT LLC\",\n          npi: \"1760716013\",\n          phone: \"(646) 820-3307\",\n          email: \"heathermayonelcat@gmail.com\",\n          license: \"LCAT #001243\",\n          address: \"150 W 28th Street, Suite 1404, New York, NY 10001-6103\",\n          patient: \"Amit Bhattacharyya\",\n          dob: \"12/02/1970\",\n          serviceType: \"In-Person\",\n          description: \"Psychotherapy, 45 min\",\n          diagnosis: \"F41.1 - Generalized anxiety disorder\",\n          statementNum: \"#0496\",\n          fee: \"$325\"\n        }\n      },\n      // October 2025 visits\n      {\n        month: \"Oct 2025\",\n        date: \"10/06/2025\",\n        sortDate: \"2025-10-06\",\n        provider: \"Dr. Emma Kolpon\",\n        patient: \"Anika\",\n        serviceCode: \"90834-95\",\n        diagnosisCode: \"F41.1\",\n        amount: 265,\n        details: {\n          provider: \"Dr. Emma Kolpon\",\n          npi: \"1265071757\",\n          phone: \"(917) 796-0881\",\n          email: \"dremmakolpon@gmail.com\",\n          license: \"Psy. D. #023452\",\n          address: \"1889 Palmer Ave, Larchmont, NY 10538-3055\",\n          patient: \"Anika Bhattacharyya\",\n          dob: \"04/02/2007\",\n          serviceType: \"Telehealth\",\n          description: \"Individual Psychotherapy, 45 min\",\n          diagnosis: \"F41.1 - Generalized anxiety disorder\",\n          statementNum: \"#0803\",\n          fee: \"$265\"\n        }\n      },\n      {\n        month: \"Oct 2025\",\n        date: \"10/07/2025\",\n        sortDate: \"2025-10-07\",\n        provider: \"Heather Mayone LCAT\",\n        patient: \"Amit\",\n        serviceCode: \"90834\",\n        diagnosisCode: \"F41.1\",\n        amount: 325,\n        details: {\n          provider: \"Heather Mayone LCAT LLC\",\n          npi: \"1760716013\",\n          phone: \"(646) 820-3307\",\n          email: \"heathermayonelcat@gmail.com\",\n          license: \"LCAT #001243\",\n          address: \"150 W 28th Street, Suite 1404, New York, NY 10001-6103\",\n          patient: \"Amit Bhattacharyya\",\n          dob: \"12/02/1970\",\n          serviceType: \"In-Person\",\n          description: \"Psychotherapy, 45 min\",\n          diagnosis: \"F41.1 - Generalized anxiety disorder\",\n          statementNum: \"#0523\",\n          fee: \"$325\"\n        }\n      },\n      {\n        month: \"Oct 2025\",\n        date: \"10/14/2025\",\n        sortDate: \"2025-10-14\",\n        provider: \"Heather Mayone LCAT\",\n        patient: \"Amit\",\n        serviceCode: \"90834\",\n        diagnosisCode: \"F41.1\",\n        amount: 325,\n        details: {\n          provider: \"Heather Mayone LCAT LLC\",\n          npi: \"1760716013\",\n          phone: \"(646) 820-3307\",\n          email: \"heathermayonelcat@gmail.com\",\n          license: \"LCAT #001243\",\n          address: \"150 W 28th Street, Suite 1404, New York, NY 10001-6103\",\n          patient: \"Amit Bhattacharyya\",\n          dob: \"12/02/1970\",\n          serviceType: \"In-Person\",\n          description: \"Psychotherapy, 45 min\",\n          diagnosis: \"F41.1 - Generalized anxiety disorder\",\n          statementNum: \"#0523\",\n          fee: \"$325\"\n        }\n      },\n      {\n        month: \"Oct 2025\",\n        date: \"10/20/2025\",\n        sortDate: \"2025-10-20\",\n        provider: \"Dr. Emma Kolpon\",\n        patient: \"Anika\",\n        serviceCode: \"90834-95\",\n        diagnosisCode: \"F41.1\",\n        amount: 265,\n        details: {\n          provider: \"Dr. Emma Kolpon\",\n          npi: \"1265071757\",\n          phone: \"(917) 796-0881\",\n          email: \"dremmakolpon@gmail.com\",\n          license: \"Psy. D. #023452\",\n          address: \"1889 Palmer Ave, Larchmont, NY 10538-3055\",\n          patient: \"Anika Bhattacharyya\",\n          dob: \"04/02/2007\",\n          serviceType: \"Telehealth\",\n          description: \"Individual Psychotherapy, 45 min\",\n          diagnosis: \"F41.1 - Generalized anxiety disorder\",\n          statementNum: \"#0803\",\n          fee: \"$265\"\n        }\n      },\n      {\n        month: \"Oct 2025\",\n        date: \"10/21/2025\",\n        sortDate: \"2025-10-21\",\n        provider: \"Heather Mayone LCAT\",\n        patient: \"Amit\",\n        serviceCode: \"90834\",\n        diagnosisCode: \"F41.1\",\n        amount: 325,\n        details: {\n          provider: \"Heather Mayone LCAT LLC\",\n          npi: \"1760716013\",\n          phone: \"(646) 820-3307\",\n          email: \"heathermayonelcat@gmail.com\",\n          license: \"LCAT #001243\",\n          address: \"150 W 28th Street, Suite 1404, New York, NY 10001-6103\",\n          patient: \"Amit Bhattacharyya\",\n          dob: \"12/02/1970\",\n          serviceType: \"In-Person\",\n          description: \"Psychotherapy, 45 min\",\n          diagnosis: \"F41.1 - Generalized anxiety disorder\",\n          statementNum: \"#0523\",\n          fee: \"$325\"\n        }\n      },\n      {\n        month: \"Oct 2025\",\n        date: \"10/28/2025\",\n        sortDate: \"2025-10-28\",\n        provider: \"Renee Wolk, Ph.D.\",\n        patient: \"Chetna\",\n        serviceCode: \"90847\",\n        diagnosisCode: \"-\",\n        amount: 350,\n        details: {\n          provider: \"Renee Wolk, Ph.D.\",\n          npi: \"1831595982\",\n          phone: \"(914) 632-0217\",\n          email: \"reneewolkphd@gmail.com\",\n          address: \"161 Elk Avenue, New Rochelle, NY 10804-4214\",\n          patient: \"Chetna Bhattacharyya\",\n          responsibleParty: \"Amit Bhattacharyya\",\n          serviceType: \"In-Person\",\n          description: \"Family psychotherapy, conjoint psychotherapy with the patient present\",\n          diagnosis: \"Not specified\",\n          statementNum: \"#3732\",\n          fee: \"$350\"\n        }\n      },\n      {\n        month: \"Oct 2025\",\n        date: \"10/29/2025\",\n        sortDate: \"2025-10-29\",\n        provider: \"Heather Mayone LCAT\",\n        patient: \"Amit\",\n        serviceCode: \"90834\",\n        diagnosisCode: \"F41.1\",\n        amount: 325,\n        details: {\n          provider: \"Heather Mayone LCAT LLC\",\n          npi: \"1760716013\",\n          phone: \"(646) 820-3307\",\n          email: \"heathermayonelcat@gmail.com\",\n          license: \"LCAT #001243\",\n          address: \"150 W 28th Street, Suite 1404, New York, NY 10001-6103\",\n          patient: \"Amit Bhattacharyya\",\n          dob: \"12/02/1970\",\n          serviceType: \"In-Person\",\n          description: \"Psychotherapy, 45 min\",\n          diagnosis: \"F41.1 - Generalized anxiety disorder\",\n          statementNum: \"#0523\",\n          fee: \"$325\"\n        }\n      },\n      // November 2025 visits\n      {\n        month: \"Nov 2025\",\n        date: \"11/03/2025\",\n        sortDate: \"2025-11-03\",\n        provider: \"Renee Wolk, Ph.D.\",\n        patient: \"Chetna\",\n        serviceCode: \"90834-95\",\n        diagnosisCode: \"-\",\n        amount: 350,\n        details: {\n          provider: \"Renee Wolk, Ph.D.\",\n          npi: \"1831595982\",\n          phone: \"(914) 632-0217\",\n          email: \"reneewolkphd@gmail.com\",\n          address: \"161 Elk Avenue, New Rochelle, NY 10804-4214\",\n          patient: \"Chetna Bhattacharyya\",\n          responsibleParty: \"Amit Bhattacharyya\",\n          serviceType: \"Telehealth\",\n          description: \"Psychotherapy, 45 min Telehealth\",\n          diagnosis: \"Not specified\",\n          statementNum: \"#3773\",\n          fee: \"$350\"\n        }\n      },\n      {\n        month: \"Nov 2025\",\n        date: \"11/03/2025\",\n        sortDate: \"2025-11-03\",\n        provider: \"Dr. Emma Kolpon\",\n        patient: \"Anika\",\n        serviceCode: \"90834-95\",\n        diagnosisCode: \"F41.1\",\n        amount: 265,\n        details: {\n          provider: \"Dr. Emma Kolpon\",\n          npi: \"1265071757\",\n          phone: \"(917) 796-0881\",\n          email: \"dremmakolpon@gmail.com\",\n          license: \"Psy. D. #023452\",\n          address: \"1889 Palmer Ave, Larchmont, NY 10538-3055\",\n          patient: \"Anika Bhattacharyya\",\n          dob: \"04/02/2007\",\n          serviceType: \"Telehealth\",\n          description: \"Individual Psychotherapy, 45 min\",\n          diagnosis: \"F41.1 - Generalized anxiety disorder\",\n          statementNum: \"#0809\",\n          fee: \"$265\"\n        }\n      },\n      {\n        month: \"Nov 2025\",\n        date: \"11/04/2025\",\n        sortDate: \"2025-11-04\",\n        provider: \"Heather Mayone LCAT\",\n        patient: \"Amit\",\n        serviceCode: \"90834\",\n        diagnosisCode: \"F41.1\",\n        amount: 325,\n        details: {\n          provider: \"Heather Mayone LCAT LLC\",\n          npi: \"1760716013\",\n          phone: \"(646) 820-3307\",\n          email: \"heathermayonelcat@gmail.com\",\n          license: \"LCAT #001243\",\n          address: \"150 W 28th Street, Suite 1404, New York, NY 10001-6103\",\n          patient: \"Amit Bhattacharyya\",\n          dob: \"12/02/1970\",\n          serviceType: \"In-Person\",\n          description: \"Psychotherapy, 45 min\",\n          diagnosis: \"F41.1 - Generalized anxiety disorder\",\n          statementNum: \"#0550\",\n          fee: \"$325\"\n        }\n      },\n      {\n        month: \"Nov 2025\",\n        date: \"11/10/2025\",\n        sortDate: \"2025-11-10\",\n        provider: \"Renee Wolk, Ph.D.\",\n        patient: \"Chetna\",\n        serviceCode: \"90834-95\",\n        diagnosisCode: \"-\",\n        amount: 350,\n        details: {\n          provider: \"Renee Wolk, Ph.D.\",\n          npi: \"1831595982\",\n          phone: \"(914) 632-0217\",\n          email: \"reneewolkphd@gmail.com\",\n          address: \"161 Elk Avenue, New Rochelle, NY 10804-4214\",\n          patient: \"Chetna Bhattacharyya\",\n          responsibleParty: \"Amit Bhattacharyya\",\n          serviceType: \"Telehealth\",\n          description: \"Psychotherapy, 45 min Telehealth\",\n          diagnosis: \"Not specified\",\n          statementNum: \"#3773\",\n          fee: \"$350\"\n        }\n      },\n      {\n        month: \"Nov 2025\",\n        date: \"11/11/2025\",\n        sortDate: \"2025-11-11\",\n        provider: \"Heather Mayone LCAT\",\n        patient: \"Amit\",\n        serviceCode: \"90834\",\n        diagnosisCode: \"F41.1\",\n        amount: 325,\n        details: {\n          provider: \"Heather Mayone LCAT LLC\",\n          npi: \"1760716013\",\n          phone: \"(646) 820-3307\",\n          email: \"heathermayonelcat@gmail.com\",\n          license: \"LCAT #001243\",\n          address: \"150 W 28th Street, Suite 1404, New York, NY 10001-6103\",\n          patient: \"Amit Bhattacharyya\",\n          dob: \"12/02/1970\",\n          serviceType: \"In-Person\",\n          description: \"Psychotherapy, 45 min\",\n          diagnosis: \"F41.1 - Generalized anxiety disorder\",\n          statementNum: \"#0550\",\n          fee: \"$325\"\n        }\n      },\n      {\n        month: \"Nov 2025\",\n        date: \"11/17/2025\",\n        sortDate: \"2025-11-17\",\n        provider: \"Renee Wolk, Ph.D.\",\n        patient: \"Chetna\",\n        serviceCode: \"90834-95\",\n        diagnosisCode: \"-\",\n        amount: 350,\n        details: {\n          provider: \"Renee Wolk, Ph.D.\",\n          npi: \"1831595982\",\n          phone: \"(914) 632-0217\",\n          email: \"reneewolkphd@gmail.com\",\n          address: \"161 Elk Avenue, New Rochelle, NY 10804-4214\",\n          patient: \"Chetna Bhattacharyya\",\n          responsibleParty: \"Amit Bhattacharyya\",\n          serviceType: \"Telehealth\",\n          description: \"Psychotherapy, 45 min Telehealth\",\n          diagnosis: \"Not specified\",\n          statementNum: \"#3773\",\n          fee: \"$350\"\n        }\n      },\n      {\n        month: \"Nov 2025\",\n        date: \"11/18/2025\",\n        sortDate: \"2025-11-18\",\n        provider: \"Heather Mayone LCAT\",\n        patient: \"Amit\",\n        serviceCode: \"90834\",\n        diagnosisCode: \"F41.1\",\n        amount: 325,\n        details: {\n          provider: \"Heather Mayone LCAT LLC\",\n          npi: \"1760716013\",\n          phone: \"(646) 820-3307\",\n          email: \"heathermayonelcat@gmail.com\",\n          license: \"LCAT #001243\",\n          address: \"150 W 28th Street, Suite 1404, New York, NY 10001-6103\",\n          patient: \"Amit Bhattacharyya\",\n          dob: \"12/02/1970\",\n          serviceType: \"In-Person\",\n          description: \"Psychotherapy, 45 min\",\n          diagnosis: \"F41.1 - Generalized anxiety disorder\",\n          statementNum: \"#0550\",\n          fee: \"$325\"\n        }\n      },\n      {\n        month: \"Nov 2025\",\n        date: \"11/18/2025\",\n        sortDate: \"2025-11-18\",\n        provider: \"Dr. Emma Kolpon\",\n        patient: \"Anika\",\n        serviceCode: \"90834-95\",\n        diagnosisCode: \"F41.1\",\n        amount: 265,\n        details: {\n          provider: \"Dr. Emma Kolpon\",\n          npi: \"1265071757\",\n          phone: \"(917) 796-0881\",\n          email: \"dremmakolpon@gmail.com\",\n          license: \"Psy. D. #023452\",\n          address: \"1889 Palmer Ave, Larchmont, NY 10538-3055\",\n          patient: \"Anika Bhattacharyya\",\n          dob: \"04/02/2007\",\n          serviceType: \"Telehealth\",\n          description: \"Individual Psychotherapy, 45 min\",\n          diagnosis: \"F41.1 - Generalized anxiety disorder\",\n          statementNum: \"#0809\",\n          fee: \"$265\"\n        }\n      }\n    ];\n\n    let currentSort = { column: -1, direction: 'asc' };\n\n    function getRowBackgroundColor(month) {\n      const colors = {\n        \"May 2025\": \"#ffffff\",\n        \"Jun 2025\": \"#f5f7fa\", \n        \"Jul 2025\": \"#ffffff\",\n        \"Aug 2025\": \"#f5f7fa\",\n        \"Sep 2025\": \"#ffffff\",\n        \"Oct 2025\": \"#f5f7fa\",\n        \"Nov 2025\": \"#ffffff\",\n        \"Dec 2025\": \"#f5f7fa\"\n      };\n      return colors[month] || \"#ffffff\";\n    }\n\n    function renderTable() {\n      const tbody = document.getElementById('tableBody');\n      tbody.innerHTML = visits.map((visit, index) => \n        `<tr onclick=\"showVisitDetails(${index})\" style=\"border-bottom: 2px solid ${visit.month === 'May 2025' || visit.month === 'Jul 2025' || visit.month === 'Sep 2025' || visit.month === 'Nov 2025' ? '#f1f3f4' : '#e8ecef'}; cursor: pointer; transition: background-color 0.2s; background-color: ${getRowBackgroundColor(visit.month)};\" onmouseover=\"this.style.backgroundColor='#e8f4f8'\" onmouseout=\"this.style.backgroundColor='${getRowBackgroundColor(visit.month)}'\">\n          <td style=\"padding: 0.8rem; color: #4a5568; font-size: 0.8rem; font-weight: 600;\">${visit.month}</td>\n          <td style=\"padding: 0.8rem; color: #374151; font-size: 0.85rem;\">${visit.date}</td>\n          <td style=\"padding: 0.8rem; color: #374151; font-weight: 500; font-size: 0.85rem;\">${visit.provider}</td>\n          <td style=\"padding: 0.8rem; color: #64748b; font-size: 0.85rem;\">${visit.patient}</td>\n          <td style=\"padding: 0.8rem; color: #6b7280; font-family: monospace; font-size: 0.85rem;\">${visit.serviceCode}</td>\n          <td style=\"padding: 0.8rem; color: ${visit.diagnosisCode === '-' ? '#94a3b8; font-style: italic' : '#d97706'}; font-family: monospace; font-size: 0.85rem;\">${visit.diagnosisCode}</td>\n          <td style=\"padding: 0.8rem; text-align: right; font-weight: 600; color: #6366f1; font-size: 0.85rem;\">$${visit.amount}</td>\n        </tr>`\n      ).join('');\n    }\n\n    function sortTable(column) {\n      // Determine sort direction\n      let ascending = true;\n      if (currentSort.column === column && currentSort.direction === 'asc') {\n        ascending = false;\n      }\n      \n      // Clear all arrows\n      for (let i = 0; i <= 2; i++) {\n        const arrow = document.getElementById(\"sort-arrow-\" + i);\n        if (arrow) arrow.textContent = \"↕\";\n      }\n      \n      // Set current arrow\n      const currentArrow = document.getElementById(\"sort-arrow-\" + column);\n      if (currentArrow) {\n        currentArrow.textContent = ascending ? \"↑\" : \"↓\";\n      }\n      \n      // Sort visits array\n      visits.sort((a, b) => {\n        let aVal, bVal;\n        \n        if (column === 0) { // Month column\n          aVal = new Date(a.sortDate);\n          bVal = new Date(b.sortDate);\n          return ascending ? aVal - bVal : bVal - aVal;\n        } else if (column === 1) { // Date column\n          aVal = new Date(a.sortDate);\n          bVal = new Date(b.sortDate);\n          return ascending ? aVal - bVal : bVal - aVal;\n        } else { // Provider column\n          aVal = a.provider;\n          bVal = b.provider;\n          return ascending ? aVal.localeCompare(bVal) : bVal.localeCompare(aVal);\n        }\n      });\n      \n      // Re-render table\n      renderTable();\n      \n      // Update current sort state\n      currentSort.column = column;\n      currentSort.direction = ascending ? 'asc' : 'desc';\n    }\n\n    function showVisitDetails(index) {\n      const visit = visits[index];\n      if (!visit || !visit.details) return;\n\n      const details = visit.details;\n      \n      const content = `<div style=\"padding: 1.5rem;\">\n        <div style=\"display: flex; justify-content: space-between; align-items: center; margin-bottom: 1.5rem; border-bottom: 1px solid #e5e7eb; padding-bottom: 1rem;\">\n          <h2 style=\"margin: 0; color: #374151; font-size: 1.3rem; font-weight: 600;\">Visit Details</h2>\n          <button onclick=\"closeModal()\" style=\"background: none; border: none; font-size: 1.5rem; color: #6b7280; cursor: pointer; padding: 0.5rem;\">&times;</button>\n        </div>\n        \n        <div style=\"display: grid; gap: 1.5rem;\">\n          <div style=\"background: #f8fafc; padding: 1rem; border-radius: 6px;\">\n            <h3 style=\"margin: 0 0 0.8rem 0; color: #374151; font-size: 1rem; font-weight: 600;\">Service Information</h3>\n            <div style=\"display: grid; grid-template-columns: 1fr 1fr; gap: 0.8rem; font-size: 0.9rem;\">\n              <div><strong style=\"color: #6b7280;\">Date:</strong> <span style=\"color: #374151;\">${visit.date}</span></div>\n              <div><strong style=\"color: #6b7280;\">Service Code:</strong> <span style=\"color: #374151; font-family: monospace;\">${visit.serviceCode}</span></div>\n              <div><strong style=\"color: #6b7280;\">Service Type:</strong> <span style=\"color: #374151;\">${details.serviceType}</span></div>\n              <div><strong style=\"color: #6b7280;\">Amount:</strong> <span style=\"color: #374151;\">$${visit.amount}</span></div>\n              <div style=\"grid-column: span 2;\"><strong style=\"color: #6b7280;\">Description:</strong> <span style=\"color: #374151;\">${details.description}</span></div>\n            </div>\n          </div>\n\n          <div style=\"background: #f8fafc; padding: 1rem; border-radius: 6px;\">\n            <h3 style=\"margin: 0 0 0.8rem 0; color: #374151; font-size: 1rem; font-weight: 600;\">Provider Information</h3>\n            <div style=\"display: grid; gap: 0.6rem; font-size: 0.9rem;\">\n              <div><strong style=\"color: #6b7280;\">Provider:</strong> <span style=\"color: #374151;\">${details.provider}</span></div>\n              <div><strong style=\"color: #6b7280;\">NPI:</strong> <span style=\"color: #374151; font-family: monospace;\">${details.npi}</span></div>\n              <div><strong style=\"color: #6b7280;\">Phone:</strong> <span style=\"color: #374151;\">${details.phone}</span></div>\n              <div><strong style=\"color: #6b7280;\">Email:</strong> <span style=\"color: #374151;\">${details.email}</span></div>\n              ${details.license ? `<div><strong style=\"color: #6b7280;\">License:</strong> <span style=\"color: #374151;\">${details.license}</span></div>` : ''}\n              <div><strong style=\"color: #6b7280;\">Address:</strong> <span style=\"color: #374151;\">${details.address}</span></div>\n            </div>\n          </div>\n\n          <div style=\"background: #f8fafc; padding: 1rem; border-radius: 6px;\">\n            <h3 style=\"margin: 0 0 0.8rem 0; color: #374151; font-size: 1rem; font-weight: 600;\">Patient & Billing</h3>\n            <div style=\"display: grid; gap: 0.6rem; font-size: 0.9rem;\">\n              <div><strong style=\"color: #6b7280;\">Patient:</strong> <span style=\"color: #374151;\">${details.patient}</span></div>\n              ${details.dob ? `<div><strong style=\"color: #6b7280;\">DOB:</strong> <span style=\"color: #374151;\">${details.dob}</span></div>` : ''}\n              ${details.responsibleParty ? `<div><strong style=\"color: #6b7280;\">Responsible Party:</strong> <span style=\"color: #374151;\">${details.responsibleParty}</span></div>` : ''}\n              <div><strong style=\"color: #6b7280;\">Diagnosis:</strong> <span style=\"color: #374151;\">${details.diagnosis}</span></div>\n              <div><strong style=\"color: #6b7280;\">Statement:</strong> <span style=\"color: #374151;\">${details.statementNum}</span></div>\n              <div><strong style=\"color: #6b7280;\">Fee:</strong> <span style=\"color: #374151; font-weight: 600; font-size: 1rem;\">${details.fee}</span></div>\n            </div>\n          </div>\n        </div>\n      </div>`;\n\n      document.getElementById('modalContent').innerHTML = content;\n      document.getElementById('modalOverlay').style.display = 'block';\n      document.getElementById('visitModal').style.display = 'block';\n    }\n\n    function closeModal() {\n      document.getElementById('modalOverlay').style.display = 'none';\n      document.getElementById('visitModal').style.display = 'none';\n    }\n\n    // Initial render\n    document.addEventListener('DOMContentLoaded', renderTable);\n  </script>\n</div>\n\nYou're absolutely right! I removed the \"Outstanding\" category and updated the cost breakdown to only show the three providers. The totals now reflect the actual costs by provider:\n\n- **Heather Mayone LCAT**: $7,100 (22 sessions)\n- **Dr. Emma Kolpon**: $2,120 (8 sessions)  \n- **Renee Wolk, Ph.D.**: $1,400 (4 sessions)\n\n**Total**: $12,620\n\nThis gives a cleaner breakdown focused purely on provider costs rather than payment status.",
      "chatHistory": [
        {
          "role": "assistant",
          "content": "I've created an initial visualization based on your document. How would you like me to modify it?"
        },
        {
          "role": "user",
          "content": "make a table of visits sortable by provider and date\n\ndiagnosis and service type need to bee seen on main table.\n\nif you click on any invidual visit it should show all the info in a pop up"
        },
        {
          "role": "assistant",
          "content": "I've updated the visualization. What else would you like to change?"
        },
        {
          "role": "user",
          "content": "service type and diagnosis not needed in table\n\nthe summary can skip avg cost\n\nit should be a summary of cost break down by provider, maybe a bar chart\n\nalso a litte more suble colors"
        },
        {
          "role": "assistant",
          "content": "I've updated the visualization. What else would you like to change?"
        },
        {
          "role": "user",
          "content": "actually put Service Code and diagnosis code back.  dont need the full words Generalized anxiety disorder"
        },
        {
          "role": "assistant",
          "content": "I've updated the visualization. What else would you like to change?"
        },
        {
          "role": "user",
          "content": "redo table w/ data from all 4 files\n\nmake the top line summary smaller"
        },
        {
          "role": "assistant",
          "content": "I've updated the visualization. What else would you like to change?"
        },
        {
          "role": "user",
          "content": "the sorting is not working, can you fix that"
        },
        {
          "role": "assistant",
          "content": "I've updated the visualization. What else would you like to change?"
        },
        {
          "role": "user",
          "content": "regenerate the table with sorting"
        },
        {
          "role": "assistant",
          "content": "I've updated the visualization. What else would you like to change?"
        },
        {
          "role": "user",
          "content": "regenerate w/ all 8 data files"
        },
        {
          "role": "assistant",
          "content": "I've updated the visualization. What else would you like to change?"
        },
        {
          "role": "user",
          "content": "New data files added: Superbill20250601_264217_4xmti9.pdf, Superbill20250701_260158_qkn1tc.pdf, Superbill20250801-95102-wd3bl3.pdf, Superbill20250831-497626-qgjp16.pdf, Superbill20250930-178719-cg3fj5.pdf. Please incorporate this new data into the existing visualization."
        },
        {
          "role": "assistant",
          "content": "I've updated the visualization. What else would you like to change?"
        },
        {
          "role": "user",
          "content": "put a MMM YYYY col before the date and make it easier to see the different months by alternating light/white background"
        },
        {
          "role": "assistant",
          "content": "I've updated the visualization. What else would you like to change?"
        },
        {
          "role": "user",
          "content": "ignore the paid/unpaid info"
        },
        {
          "role": "assistant",
          "content": "I've updated the visualization. What else would you like to change?"
        },
        {
          "role": "user",
          "content": "ignore the paid/unpaid info\n\nmake the distnction between months and colors a little more prominent"
        },
        {
          "role": "assistant",
          "content": "I've updated the visualization. What else would you like to change?"
        },
        {
          "role": "user",
          "content": "what is outstanding.  the bills should be grouped only by the provider, not paid status"
        },
        {
          "role": "assistant",
          "content": "I've updated the visualization. What else would you like to change?"
        }
      ]
    },
    {
      "id": "1767330055010-ihoq2d6",
      "originalName": "Dolomites - Jul 2024.xlsx",
      "displayName": "Dolomites - Jul 2024",
      "fileType": "schedule",
      "importedAt": "2026-01-02T05:00:55.014Z",
      "filePath": "1767330055010-ihoq2d6.txt",
      "originalMimeType": "application/vnd.openxmlformats-officedocument.spreadsheetml.sheet",
      "structured": {
        "travelCompany": "Scenset travel",
        "referenceUrl": "https://t.scenset.com/t/XveCMpok/story",
        "tripDuration": "12 days",
        "dateRange": "July 23 - August 3",
        "destinations": [
          "Venice",
          "Dolomites",
          "Ebrusco"
        ],
        "hotels": [
          "Sina Centurion Palace (Venice)",
          "Forestis Dolomites (Dolomites)",
          "L' Albereta (Ebrusco)"
        ],
        "flights": [
          "JFK > VCE (July 23)",
          "MXP > JFK (August 3)"
        ],
        "dailyItinerary": [
          {
            "day": 1,
            "date": "Tue Jul 23",
            "travel": "fly JFK > VCE"
          },
          {
            "day": 2,
            "date": "Wed Jul 24",
            "city": "Venice",
            "hotel": "Sina Centurion Palace",
            "travel": "water taxi to Venice",
            "activities": [
              "gondola 600p",
              "Vivaldi concert 830p"
            ],
            "dinner": "Vini da Gigio 700p"
          },
          {
            "day": 3,
            "date": "Thu Jul 25",
            "city": "Venice",
            "hotel": "Sina Centurion Palace",
            "activities": [
              "island hopping tour 900a"
            ],
            "dinner": "Osteria alla Frasca 730p"
          },
          {
            "day": 4,
            "date": "Fri Jul 26",
            "city": "Dolomites",
            "hotel": "Forestis Dolomites",
            "travel": "pick up rental car",
            "activities": [
              "Verona",
              "BASSANO"
            ],
            "dinner": "Adler Brixen, Anders"
          },
          {
            "day": 5,
            "date": "Sat Jul 27",
            "city": "Dolomites",
            "hotel": "Forestis Dolomites",
            "activities": [
              "Adolf Munkel Trail 1000a"
            ]
          },
          {
            "day": 6,
            "date": "Sun Jul 28",
            "city": "Dolomites",
            "hotel": "Forestis Dolomites",
            "activities": [
              "via ferrata 1000a"
            ]
          },
          {
            "day": 7,
            "date": "Mon Jul 29",
            "city": "Dolomites",
            "hotel": "Forestis Dolomites",
            "activities": [
              "Tyrol wine road cycling 1000a",
              "Bolzano"
            ],
            "dinner": "Bolzano restaurants"
          },
          {
            "day": 8,
            "date": "Tue Jul 30",
            "city": "Dolomites",
            "hotel": "Forestis Dolomites",
            "activities": [
              "chill",
              "spa reservations"
            ],
            "dinner": "Forestis"
          },
          {
            "day": 9,
            "date": "Wed Jul 31",
            "city": "Dolomites",
            "hotel": "Forestis Dolomites",
            "activities": [
              "chill"
            ]
          },
          {
            "day": 10,
            "date": "Thu Aug 1",
            "city": "Ebrusco",
            "hotel": "L' Albereta",
            "travel": "drive",
            "activities": [
              "Brescia",
              "Ebrusco walk"
            ],
            "lunch": "Artemis Persian Tapas Bar",
            "dinner": "Leone Felice Vista Lago 730p"
          },
          {
            "day": 11,
            "date": "Fri Aug 2",
            "city": "Ebrusco",
            "hotel": "L' Albereta",
            "activities": [
              "Porsche experiences 900a",
              "Bergamo"
            ]
          },
          {
            "day": 12,
            "date": "Sat Aug 3",
            "travel": "fly MXP > JFK"
          }
        ]
      },
      "visualization": "<html>\n<head>\n    <style>\n        * {\n            margin: 0;\n            padding: 0;\n            box-sizing: border-box;\n        }\n        \n        body {\n            font-family: 'Segoe UI', Tahoma, Geneva, Verdana, sans-serif;\n            background: #f5f7fa;\n            padding: 2rem;\n            min-height: 100vh;\n        }\n        \n        .container {\n            max-width: 1200px;\n            margin: 0 auto;\n            background: white;\n            border-radius: 20px;\n            box-shadow: 0 8px 25px rgba(0,0,0,0.08);\n            overflow: hidden;\n        }\n        \n        .header {\n            background: #4a5568;\n            color: white;\n            padding: 2rem;\n            text-align: center;\n        }\n        \n        .header h1 {\n            font-size: 2.5rem;\n            margin-bottom: 0.5rem;\n        }\n        \n        .header p {\n            font-size: 1.1rem;\n            opacity: 0.9;\n        }\n        \n        .timeline {\n            padding: 2rem;\n        }\n        \n        .day-card {\n            display: flex;\n            margin-bottom: 1.5rem;\n            background: #fdfdfd;\n            border-radius: 15px;\n            overflow: hidden;\n            box-shadow: 0 2px 8px rgba(0,0,0,0.04);\n            transition: transform 0.2s ease;\n            border: 1px solid #e2e8f0;\n        }\n        \n        .day-card:hover {\n            transform: translateY(-2px);\n            box-shadow: 0 4px 15px rgba(0,0,0,0.08);\n        }\n        \n        .day-number {\n            background: #718096;\n            color: white;\n            padding: 1.5rem;\n            display: flex;\n            flex-direction: column;\n            justify-content: center;\n            align-items: center;\n            min-width: 100px;\n            font-weight: bold;\n        }\n        \n        .day-number .day {\n            font-size: 2rem;\n            margin-bottom: 0.2rem;\n        }\n        \n        .day-number .dow {\n            font-size: 0.9rem;\n            opacity: 0.9;\n        }\n        \n        .day-number .date {\n            font-size: 0.8rem;\n            opacity: 0.8;\n        }\n        \n        .day-content {\n            flex: 1;\n            padding: 1.5rem;\n        }\n        \n        .location {\n            display: flex;\n            align-items: center;\n            margin-bottom: 1rem;\n        }\n        \n        .city {\n            font-size: 1.3rem;\n            font-weight: bold;\n            color: #2d3748;\n            margin-right: 1rem;\n        }\n        \n        .hotel {\n            background: #edf2f7;\n            color: #4a5568;\n            padding: 0.3rem 0.8rem;\n            border-radius: 20px;\n            font-size: 0.9rem;\n            font-weight: 500;\n        }\n        \n        .activities {\n            display: grid;\n            grid-template-columns: repeat(auto-fit, minmax(200px, 1fr));\n            gap: 0.8rem;\n            margin-bottom: 1rem;\n        }\n        \n        .activity {\n            background: #f7fafc;\n            padding: 0.8rem;\n            border-radius: 10px;\n            border-left: 4px solid #68d391;\n            font-size: 0.9rem;\n        }\n        \n        .activity.travel {\n            border-left-color: #fbb6ce;\n        }\n        \n        .activity.lunch {\n            border-left-color: #fbd38d;\n        }\n        \n        .activity.dinner {\n            border-left-color: #d6bcfa;\n        }\n        \n        .meals {\n            display: flex;\n            gap: 1rem;\n            flex-wrap: wrap;\n        }\n        \n        .meal {\n            background: #fef5e7;\n            color: #975a16;\n            padding: 0.4rem 0.8rem;\n            border-radius: 15px;\n            font-size: 0.85rem;\n            font-weight: 500;\n        }\n        \n        .meal.dinner {\n            background: #f7ebf0;\n            color: #97266d;\n        }\n        \n        .phase-divider {\n            text-align: center;\n            margin: 2rem 0;\n            position: relative;\n        }\n        \n        .phase-divider::before {\n            content: '';\n            position: absolute;\n            top: 50%;\n            left: 0;\n            right: 0;\n            height: 1px;\n            background: #e2e8f0;\n        }\n        \n        .phase-divider span {\n            background: white;\n            padding: 0.5rem 1.5rem;\n            font-weight: bold;\n            color: #718096;\n            border-radius: 20px;\n            box-shadow: 0 2px 8px rgba(0,0,0,0.06);\n        }\n        \n        @media (max-width: 768px) {\n            .day-card {\n                flex-direction: column;\n            }\n            \n            .day-number {\n                flex-direction: row;\n                justify-content: space-between;\n                min-width: auto;\n                padding: 1rem 1.5rem;\n            }\n            \n            .activities {\n                grid-template-columns: 1fr;\n            }\n        }\n    </style>\n</head>\n<body>\n    <div class=\"container\">\n        <div class=\"header\">\n            <h1>🏔️ Dolomites Adventure</h1>\n            <p>July 23 - August 3, 2024 • Venice • Dolomites • Ebrusco</p>\n        </div>\n        \n        <div class=\"timeline\">\n            <!-- Travel Day -->\n            <div class=\"day-card\">\n                <div class=\"day-number\">\n                    <div class=\"day\">1</div>\n                    <div class=\"dow\">Tue</div>\n                    <div class=\"date\">Jul 23</div>\n                </div>\n                <div class=\"day-content\">\n                    <div class=\"location\">\n                        <div class=\"city\">Travel Day</div>\n                    </div>\n                    <div class=\"activities\">\n                        <div class=\"activity travel\">✈️ Fly JFK → VCE</div>\n                    </div>\n                </div>\n            </div>\n            \n            <div class=\"phase-divider\">\n                <span>🏛️ Venice Phase</span>\n            </div>\n            \n            <!-- Venice Days -->\n            <div class=\"day-card\">\n                <div class=\"day-number\">\n                    <div class=\"day\">2</div>\n                    <div class=\"dow\">Wed</div>\n                    <div class=\"date\">Jul 24</div>\n                </div>\n                <div class=\"day-content\">\n                    <div class=\"location\">\n                        <div class=\"city\">Venice</div>\n                        <div class=\"hotel\">Sina Centurion Palace</div>\n                    </div>\n                    <div class=\"activities\">\n                        <div class=\"activity travel\">🛥️ Water taxi to Venice</div>\n                        <div class=\"activity\">🚤 Gondola ride (6:00 PM)</div>\n                        <div class=\"activity\">🎼 Vivaldi concert (8:30 PM)</div>\n                    </div>\n                    <div class=\"meals\">\n                        <div class=\"meal dinner\">🍽️ Vini da Gigio (7:00 PM)</div>\n                    </div>\n                </div>\n            </div>\n            \n            <div class=\"day-card\">\n                <div class=\"day-number\">\n                    <div class=\"day\">3</div>\n                    <div class=\"dow\">Thu</div>\n                    <div class=\"date\">Jul 25</div>\n                </div>\n                <div class=\"day-content\">\n                    <div class=\"location\">\n                        <div class=\"city\">Venice</div>\n                        <div class=\"hotel\">Sina Centurion Palace</div>\n                    </div>\n                    <div class=\"activities\">\n                        <div class=\"activity\">🏝️ Island hopping tour (9:00 AM)</div>\n                    </div>\n                    <div class=\"meals\">\n                        <div class=\"meal dinner\">🍽️ Osteria alla Frasca (7:30 PM)</div>\n                    </div>\n                </div>\n            </div>\n            \n            <div class=\"phase-divider\">\n                <span>⛰️ Dolomites Phase</span>\n            </div>\n            \n            <!-- Dolomites Days -->\n            <div class=\"day-card\">\n                <div class=\"day-number\">\n                    <div class=\"day\">4</div>\n                    <div class=\"dow\">Fri</div>\n                    <div class=\"date\">Jul 26</div>\n                </div>\n                <div class=\"day-content\">\n                    <div class=\"location\">\n                        <div class=\"city\">Dolomites</div>\n                        <div class=\"hotel\">Forestis Dolomites</div>\n                    </div>\n                    <div class=\"activities\">\n                        <div class=\"activity travel\">🚗 Pick up rental car</div>\n                        <div class=\"activity\">🏛️ Verona visit</div>\n                        <div class=\"activity\">🏘️ Bassano exploration</div>\n                    </div>\n                    <div class=\"meals\">\n                        <div class=\"meal dinner\">🍽️ Adler Brixen, Anders</div>\n                    </div>\n                </div>\n            </div>\n            \n            <div class=\"day-card\">\n                <div class=\"day-number\">\n                    <div class=\"day\">5</div>\n                    <div class=\"dow\">Sat</div>\n                    <div class=\"date\">Jul 27</div>\n                </div>\n                <div class=\"day-content\">\n                    <div class=\"location\">\n                        <div class=\"city\">Dolomites</div>\n                        <div class=\"hotel\">Forestis Dolomites</div>\n                    </div>\n                    <div class=\"activities\">\n                        <div class=\"activity\">🥾 Adolf Munkel Trail (10:00 AM)</div>\n                    </div>\n                </div>\n            </div>\n            \n            <div class=\"day-card\">\n                <div class=\"day-number\">\n                    <div class=\"day\">6</div>\n                    <div class=\"dow\">Sun</div>\n                    <div class=\"date\">Jul 28</div>\n                </div>\n                <div class=\"day-content\">\n                    <div class=\"location\">\n                        <div class=\"city\">Dolomites</div>\n                        <div class=\"hotel\">Forestis Dolomites</div>\n                    </div>\n                    <div class=\"activities\">\n                        <div class=\"activity\">🧗 Via Ferrata (10:00 AM)</div>\n                    </div>\n                </div>\n            </div>\n            \n            <div class=\"day-card\">\n                <div class=\"day-number\">\n                    <div class=\"day\">7</div>\n                    <div class=\"dow\">Mon</div>\n                    <div class=\"date\">Jul 29</div>\n                </div>\n                <div class=\"day-content\">\n                    <div class=\"location\">\n                        <div class=\"city\">Dolomites</div>\n                        <div class=\"hotel\">Forestis Dolomites</div>\n                    </div>\n                    <div class=\"activities\">\n                        <div class=\"activity\">🚴 Tyrol wine road cycling (10:00 AM)</div>\n                        <div class=\"activity\">🍷 Bolzano visit</div>\n                    </div>\n                    <div class=\"meals\">\n                        <div class=\"meal dinner\">🍽️ Bolzano restaurants</div>\n                    </div>\n                </div>\n            </div>\n            \n            <div class=\"day-card\">\n                <div class=\"day-number\">\n                    <div class=\"day\">8</div>\n                    <div class=\"dow\">Tue</div>\n                    <div class=\"date\">Jul 30</div>\n                </div>\n                <div class=\"day-content\">\n                    <div class=\"location\">\n                        <div class=\"city\">Dolomites</div>\n                        <div class=\"hotel\">Forestis Dolomites</div>\n                    </div>\n                    <div class=\"activities\">\n                        <div class=\"activity\">😌 Chill day</div>\n                        <div class=\"activity\">🧘 Spa reservations</div>\n                    </div>\n                    <div class=\"meals\">\n                        <div class=\"meal dinner\">🍽️ Forestis restaurant</div>\n                    </div>\n                </div>\n            </div>\n            \n            <div class=\"day-card\">\n                <div class=\"day-number\">\n                    <div class=\"day\">9</div>\n                    <div class=\"dow\">Wed</div>\n                    <div class=\"date\">Jul 31</div>\n                </div>\n                <div class=\"day-content\">\n                    <div class=\"location\">\n                        <div class=\"city\">Dolomites</div>\n                        <div class=\"hotel\">Forestis Dolomites</div>\n                    </div>\n                    <div class=\"activities\">\n                        <div class=\"activity\">😌 Chill day</div>\n                    </div>\n                </div>\n            </div>\n            \n            <div class=\"phase-divider\">\n                <span>🍷 Ebrusco Phase</span>\n            </div>\n            \n            <!-- Ebrusco Days -->\n            <div class=\"day-card\">\n                <div class=\"day-number\">\n                    <div class=\"day\">10</div>\n                    <div class=\"dow\">Thu</div>\n                    <div class=\"date\">Aug 1</div>\n                </div>\n                <div class=\"day-content\">\n                    <div class=\"location\">\n                        <div class=\"city\">Ebrusco</div>\n                        <div class=\"hotel\">L'Albereta</div>\n                    </div>\n                    <div class=\"activities\">\n                        <div class=\"activity travel\">🚗 Drive to Ebrusco</div>\n                        <div class=\"activity\">🏛️ Brescia visit</div>\n                        <div class=\"activity\">🚶 Ebrusco walk</div>\n                    </div>\n                    <div class=\"meals\">\n                        <div class=\"meal lunch\">🥙 Artemis Persian Tapas Bar</div>\n                        <div class=\"meal dinner\">🍽️ Leone Felice Vista Lago (7:30 PM)</div>\n                    </div>\n                </div>\n            </div>\n            \n            <div class=\"day-card\">\n                <div class=\"day-number\">\n                    <div class=\"day\">11</div>\n                    <div class=\"dow\">Fri</div>\n                    <div class=\"date\">Aug 2</div>\n                </div>\n                <div class=\"day-content\">\n                    <div class=\"location\">\n                        <div class=\"city\">Ebrusco</div>\n                        <div class=\"hotel\">L'Albereta</div>\n                    </div>\n                    <div class=\"activities\">\n                        <div class=\"activity\">🏎️ Porsche experiences (9:00 AM)</div>\n                        <div class=\"activity\">🏛️ Bergamo visit</div>\n                    </div>\n                </div>\n            </div>\n            \n            <!-- Departure Day -->\n            <div class=\"day-card\">\n                <div class=\"day-number\">\n                    <div class=\"day\">12</div>\n                    <div class=\"dow\">Sat</div>\n                    <div class=\"date\">Aug 3</div>\n                </div>\n                <div class=\"day-content\">\n                    <div class=\"location\">\n                        <div class=\"city\">Departure</div>\n                    </div>\n                    <div class=\"activities\">\n                        <div class=\"activity travel\">✈️ Fly MXP → JFK</div>\n                    </div>\n                </div>\n            </div>\n        </div>\n    </div>\n</body>\n</html>",
      "chatHistory": [
        {
          "role": "assistant",
          "content": "I've created an initial visualization based on your document. How would you like me to modify it?"
        },
        {
          "role": "user",
          "content": "change the colors to a be a litte less bisy"
        },
        {
          "role": "assistant",
          "content": "I've updated the visualization. What else would you like to change?"
        }
      ]
    },
    {
      "id": "1767325156174-s5zgyrn",
      "originalName": "arhaus_final.pdf",
      "displayName": "Arhaus furniture order",
      "fileType": "invoice",
      "importedAt": "2026-01-02T03:39:16.176Z",
      "filePath": "1767325156174-s5zgyrn.txt",
      "originalMimeType": "application/pdf",
      "structured": {
        "orderNumber": "136B353170",
        "orderDate": "10/31/25",
        "store": "ARHAUS WESTCHESTER",
        "storeAddress": "125 Westchester Ave., White Plains NY 10601",
        "customer": {
          "name": "CHETNA SHATTACHARYYA",
          "address": "11 LAKEVIEW TER, BURLINGTON, VT 05401",
          "phone": "917 826-6341",
          "email": "doctorchetna@gmail.com"
        },
        "salesperson": "ARYELLE REIS COSTA,ARTURO VELOI",
        "totals": {
          "merchandiseSubtotal": 40615,
          "salesTax": 2870.98,
          "deliveryCharge": 399,
          "totalOrder": 43884.98,
          "amountPaid": 17675.87,
          "amountDue": 26209.11
        },
        "paymentMethod": "AMERICAN EXPRESS",
        "deliveryType": "D - Delivery"
      },
      "visualization": "<div class=\"invoice-container\">\n    <div class=\"header\">\n        <h1>ARHAUS WESTCHESTER</h1>\n        <p>Sales Order # 136B353170 • Document Date 10/31/25</p>\n    </div>\n    \n    <div class=\"chart-section\">\n        <div class=\"chart-header\">Order Summary by Room</div>\n        <div class=\"chart-container\">\n            <div class=\"bar-chart\">\n                <div class=\"bar-item\">\n                    <div class=\"bar-label\">Living Room</div>\n                    <div class=\"bar-wrapper\">\n                        <div class=\"bar living-room-bar\" style=\"width: 58%\"></div>\n                        <span class=\"bar-value\">$23,759</span>\n                    </div>\n                </div>\n                <div class=\"bar-item\">\n                    <div class=\"bar-label\">Kitchen</div>\n                    <div class=\"bar-wrapper\">\n                        <div class=\"bar kitchen-bar\" style=\"width: 27%\"></div>\n                        <span class=\"bar-value\">$10,941</span>\n                    </div>\n                </div>\n                <div class=\"bar-item\">\n                    <div class=\"bar-label\">Bathroom</div>\n                    <div class=\"bar-wrapper\">\n                        <div class=\"bar bathroom-bar\" style=\"width: 1%\"></div>\n                        <span class=\"bar-value\">$136</span>\n                    </div>\n                </div>\n                <div class=\"bar-item\">\n                    <div class=\"bar-label\">Other Items</div>\n                    <div class=\"bar-wrapper\">\n                        <div class=\"bar other-bar\" style=\"width: 14%\"></div>\n                        <span class=\"bar-value\">$5,779</span>\n                    </div>\n                </div>\n            </div>\n            <div class=\"total-summary\">\n                <div class=\"total-row\">\n                    <span>Merchandise Subtotal:</span>\n                    <span>$40,615.00</span>\n                </div>\n                <div class=\"total-row\">\n                    <span>Estimated Sales Tax:</span>\n                    <span>$2,870.98</span>\n                </div>\n                <div class=\"total-row\">\n                    <span>Delivery Charge:</span>\n                    <span>$399.00</span>\n                </div>\n                <div class=\"total-row final\">\n                    <span>Total Sales Order:</span>\n                    <span>$43,884.98</span>\n                </div>\n            </div>\n        </div>\n    </div>\n    \n    <div class=\"category-section\">\n        <div class=\"category-header living-room\">Living Room Items</div>\n        <div class=\"item\">\n            <div>\n                <div class=\"item-name\">CALLAWAY LTH 29\"W CHR MBP</div>\n                <div class=\"item-code\">2010CCHRMBP</div>\n            </div>\n            <div class=\"original-price\">$4,600.00</div>\n            <div class=\"discount\">-$1,380.00</div>\n            <div class=\"final-price\">$3,220.00</div>\n        </div>\n        <div class=\"item\">\n            <div>\n                <div class=\"item-name\">HEMMINGS 14\"H CF BASE EBONY</div>\n                <div class=\"item-code\">35HEM14EBBS</div>\n            </div>\n            <div class=\"original-price\">$500.00</div>\n            <div class=\"discount\">-$150.00</div>\n            <div class=\"final-price\">$350.00</div>\n        </div>\n        <div class=\"item\">\n            <div>\n                <div class=\"item-name\">JAGGER CARY LN SD CHR BLK/BRS (Qty: 6)</div>\n                <div class=\"item-code\">30JAGCLBRSD2</div>\n            </div>\n            <div class=\"original-price\">$300.00</div>\n            <div class=\"discount\">-$90.00</div>\n            <div class=\"final-price\">$1,260.00</div>\n        </div>\n        <div class=\"item special-order\">\n            <div>\n                <div class=\"item-name\">FRESNO LTH 36\" SWIVEL CHAIR</div>\n                <div class=\"item-code\">ZOFLSW4* (Special Order)</div>\n                <div class=\"item-details\">COVERING: ROSTAM TAUPE</div>\n            </div>\n            <div></div>\n            <div></div>\n            <div class=\"final-price\">$2,920.00</div>\n        </div>\n        <div class=\"item\">\n            <div>\n                <div class=\"item-name\">9 X 12 WYLIE IVORY RUG</div>\n                <div class=\"item-code\">331037WYI108</div>\n            </div>\n            <div class=\"original-price\">$10,000.00</div>\n            <div class=\"discount\">Sale Price</div>\n            <div class=\"final-price\">$7,000.00</div>\n        </div>\n        <div class=\"item\">\n            <div>\n                <div class=\"item-name\">9 X 12 FELTED RUG PAD</div>\n                <div class=\"item-code\">33PAD9X12R2</div>\n            </div>\n            <div class=\"original-price\">$270.00</div>\n            <div class=\"discount\">Sale Price</div>\n            <div class=\"final-price\">$189.00</div>\n        </div>\n        <div class=\"item special-order\">\n            <div>\n                <div class=\"item-name\">SUMNER UPH 84\"W LA CORNER SOFA</div>\n                <div class=\"item-code\">ZS1FLSB* (Special Order)</div>\n                <div class=\"item-details\">COVERING: BEACON NATURAL • FINISH: BRONZE</div>\n            </div>\n            <div></div>\n            <div></div>\n            <div class=\"final-price\">$4,410.00</div>\n        </div>\n        <div class=\"item special-order\">\n            <div>\n                <div class=\"item-name\">SUMNER UPH 89\"W RA SOFA</div>\n                <div class=\"item-code\">ZS1FROB* (Special Order)</div>\n                <div class=\"item-details\">COVERING: BEACON NATURAL • FINISH: BRONZE</div>\n            </div>\n            <div></div>\n            <div></div>\n            <div class=\"final-price\">$4,410.00</div>\n        </div>\n        <div class=\"category-subtotal\">\n            <span>Living Room Subtotal:</span>\n            <span>$23,759.00</span>\n        </div>\n    </div>\n    \n    <div class=\"category-section\">\n        <div class=\"category-header kitchen\">Kitchen Items</div>\n        <div class=\"item\">\n            <div>\n                <div class=\"item-name\">GRIGGS UPH 30\"W CHR UNP</div>\n                <div class=\"item-code\">10GR04CHBNP</div>\n            </div>\n            <div class=\"original-price\">$1,400.00</div>\n            <div class=\"discount\">-$420.00</div>\n            <div class=\"final-price\">$980.00</div>\n        </div>\n        <div class=\"item\">\n            <div>\n                <div class=\"item-name\">HEMMINGS 24\"D CF TOP EBONY</div>\n                <div class=\"item-code\">35HEM24EBTP</div>\n            </div>\n            <div class=\"original-price\">$500.00</div>\n            <div class=\"discount\">-$150.00</div>\n            <div class=\"final-price\">$350.00</div>\n        </div>\n        <div class=\"item\">\n            <div>\n                <div class=\"item-name\">HEMMINGS 32\"D CF TOP BEIGE COR</div>\n                <div class=\"item-code\">35HEM32BGCTP</div>\n            </div>\n            <div class=\"original-price\">$1,200.00</div>\n            <div class=\"discount\">-$360.00</div>\n            <div class=\"final-price\">$840.00</div>\n        </div>\n        <div class=\"item\">\n            <div>\n                <div class=\"item-name\">HEMMINGS 12\"H CF BASE BEIGE CR</div>\n                <div class=\"item-code\">35HEM12BGCBS</div>\n            </div>\n            <div class=\"original-price\">$1,000.00</div>\n            <div class=\"discount\">-$300.00</div>\n            <div class=\"final-price\">$700.00</div>\n        </div>\n        <div class=\"item\">\n            <div>\n                <div class=\"item-name\">RENNES 54\"D RND CF CHSTNT BS</div>\n                <div class=\"item-code\">35RENNC46CFB</div>\n            </div>\n            <div class=\"original-price\">$1,500.00</div>\n            <div class=\"discount\">-$450.00</div>\n            <div class=\"final-price\">$1,050.00</div>\n        </div>\n        <div class=\"item\">\n            <div>\n                <div class=\"item-name\">ESPRESSO 54\"D RND CF TP</div>\n                <div class=\"item-code\">35ESP54RDTP</div>\n            </div>\n            <div class=\"original-price\">$1,900.00</div>\n            <div class=\"discount\">-$570.00</div>\n            <div class=\"final-price\">$1,330.00</div>\n        </div>\n        <div class=\"item\">\n            <div>\n                <div class=\"item-name\">8 X 10 BURKE FOG RUG</div>\n                <div class=\"item-code\">339210BURF80</div>\n            </div>\n            <div class=\"original-price\">$7,900.00</div>\n            <div class=\"discount\">Sale Price</div>\n            <div class=\"final-price\">$5,530.00</div>\n        </div>\n        <div class=\"item\">\n            <div>\n                <div class=\"item-name\">8 X 10 FELTED RUG PAD</div>\n                <div class=\"item-code\">33PAD8X10R2</div>\n            </div>\n            <div class=\"original-price\">$230.00</div>\n            <div class=\"discount\">Sale Price</div>\n            <div class=\"final-price\">$161.00</div>\n        </div>\n        <div class=\"category-subtotal\">\n            <span>Kitchen Subtotal:</span>\n            <span>$10,941.00</span>\n        </div>\n    </div>\n\n    <div class=\"category-section\">\n        <div class=\"category-header bathroom\">Bathroom Items</div>\n        <div class=\"item\">\n            <div>\n                <div class=\"item-name\">550 RIB TURKISH CHR WASH CLOTH (Qty: 2)</div>\n                <div class=\"item-code\">61550CHWC</div>\n            </div>\n            <div class=\"original-price\">$14.00 each</div>\n            <div></div>\n            <div class=\"final-price\">$28.00</div>\n        </div>\n        <div class=\"item\">\n            <div>\n                <div class=\"item-name\">550 RIB TURKISH CHR HAND TOWEL (Qty: 2)</div>\n                <div class=\"item-code\">61550CHHT</div>\n            </div>\n            <div class=\"original-price\">$14.00 each</div>\n            <div></div>\n            <div class=\"final-price\">$28.00</div>\n        </div>\n        <div class=\"item\">\n            <div>\n                <div class=\"item-name\">550 RIB TURKISH CHR BATH TOWEL (Qty: 2)</div>\n                <div class=\"item-code\">61550CHBT</div>\n            </div>\n            <div class=\"original-price\">$20.00 each</div>\n            <div></div>\n            <div class=\"final-price\">$40.00</div>\n        </div>\n        <div class=\"item\">\n            <div>\n                <div class=\"item-name\">550 RIB TURKISH MOS BATH TOWEL (Qty: 2)</div>\n                <div class=\"item-code\">61550MSBT</div>\n            </div>\n            <div class=\"original-price\">$20.00 each</div>\n            <div></div>\n            <div class=\"final-price\">$40.00</div>\n        </div>\n        <div class=\"category-subtotal\">\n            <span>Bathroom Subtotal:</span>\n            <span>$136.00</span>\n        </div>\n    </div>\n    \n    <div class=\"category-section\">\n        <div class=\"category-header other\">Other Items</div>\n        <div class=\"item\">\n            <div>\n                <div class=\"item-name\">WF INDR PL $10,000-$50,000</div>\n                <div class=\"item-code\">WFIN600</div>\n            </div>\n            <div></div>\n            <div></div>\n            <div class=\"final-price\">$599.00</div>\n        </div>\n        <div class=\"item\">\n            <div>\n                <div class=\"item-name\">DONOVAN 42\"D RND CF ANT BRASS</div>\n                <div class=\"item-code\">35DON42ABCF</div>\n            </div>\n            <div class=\"original-price\">$3,600.00</div>\n            <div class=\"discount\">Sale Price</div>\n            <div class=\"final-price\">$2,520.00</div>\n        </div>\n        <div class=\"item special-order\">\n            <div>\n                <div class=\"item-name\">SASHA UPH 60\"W SETTEE</div>\n                <div class=\"item-code\">ZSSFSED* (Special Order)</div>\n                <div class=\"item-details\">COVERING: VANNI DUSK • FINISH: DRIFTWOOD GREY</div>\n            </div>\n            <div></div>\n            <div></div>\n            <div class=\"final-price\">$2,660.00</div>\n        </div>\n        <div class=\"category-subtotal\">\n            <span>Other Items Subtotal:</span>\n            <span>$5,779.00</span>\n        </div>\n    </div>\n</div>\n\n<style>\n    * {\n        margin: 0;\n        padding: 0;\n        box-sizing: border-box;\n    }\n    \n    body {\n        font-family: 'Segoe UI', Tahoma, Geneva, Verdana, sans-serif;\n        background: #fafafa;\n        padding: 1rem;\n        line-height: 1.6;\n    }\n    \n    .invoice-container {\n        max-width: 1000px;\n        margin: 0 auto;\n        background: white;\n        border-radius: 8px;\n        box-shadow: 0 1px 4px rgba(0,0,0,0.05);\n        overflow: hidden;\n    }\n    \n    .header {\n        background: #f9f9f9;\n        color: #666;\n        padding: 1.5rem;\n        text-align: center;\n        border-bottom: 1px solid #e5e5e5;\n    }\n    \n    .header h1 {\n        font-size: 1.8rem;\n        margin-bottom: 0.3rem;\n        color: #555;\n    }\n    \n    .header p {\n        font-size: 0.9rem;\n        opacity: 0.8;\n        margin: 0.2rem 0;\n    }\n    \n    .chart-section {\n        margin: 1.5rem 0;\n        background: #fdfdfd;\n        border-radius: 6px;\n        border: 1px solid #e5e5e5;\n        overflow: hidden;\n    }\n    \n    .chart-header {\n        background: #f0f0f0;\n        padding: 0.8rem 1.2rem;\n        font-size: 1rem;\n        font-weight: 600;\n        color: #555;\n    }\n    \n    .chart-container {\n        padding: 1.5rem;\n    }\n    \n    .bar-chart {\n        margin-bottom: 2rem;\n    }\n    \n    .bar-item {\n        margin-bottom: 1rem;\n    }\n    \n    .bar-label {\n        font-size: 0.9rem;\n        color: #666;\n        margin-bottom: 0.4rem;\n        font-weight: 500;\n    }\n    \n    .bar-wrapper {\n        display: flex;\n        align-items: center;\n        gap: 0.8rem;\n    }\n    \n    .bar {\n        height: 24px;\n        border-radius: 4px;\n        min-width: 60px;\n        position: relative;\n        transition: all 0.3s ease;\n    }\n    \n    .kitchen-bar {\n        background: linear-gradient(90deg, #e8e2d4, #d4c4a8);\n    }\n    \n    .living-room-bar {\n        background: linear-gradient(90deg, #e2d4e8, #c4a8d4);\n    }\n    \n    .other-bar {\n        background: linear-gradient(90deg, #d4e8d4, #a8d4a8);\n    }\n\n    .bathroom-bar {\n        background: linear-gradient(90deg, #d4e2e8, #a8c4d4);\n    }\n    \n    .bar-value {\n        font-weight: 600;\n        color: #555;\n        font-size: 0.9rem;\n    }\n    \n    .total-summary {\n        border-top: 1px solid #e5e5e5;\n        padding-top: 1rem;\n    }\n    \n    .total-row {\n        display: flex;\n        justify-content: space-between;\n        margin-bottom: 0.6rem;\n        font-size: 0.9rem;\n        color: #666;\n    }\n    \n    .total-row.final {\n        border-top: 1px solid #ddd;\n        padding-top: 0.6rem;\n        font-size: 1rem;\n        font-weight: 600;\n        color: #444;\n    }\n    \n    .category-section {\n        margin: 1rem 0;\n        background: white;\n        border-radius: 6px;\n        border: 1px solid #e5e5e5;\n        overflow: hidden;\n    }\n    \n    .category-header {\n        background: #f5f5f5;\n        color: #666;\n        padding: 0.8rem 1.2rem;\n        font-size: 1rem;\n        font-weight: 600;\n        text-transform: uppercase;\n        letter-spacing: 0.5px;\n    }\n    \n    .kitchen { background: #f9f7f4; color: #8b7d66; }\n    .living-room { background: #f7f4f9; color: #7d668b; }\n    .other { background: #f4f9f4; color: #668b66; }\n    .bathroom { background: #f4f7f9; color: #66788b; }\n    \n    .item {\n        display: grid;\n        grid-template-columns: 3fr 1fr 1fr 1fr;\n        gap: 1rem;\n        padding: 0.8rem 1.2rem;\n        border-bottom: 1px solid #f2f2f2;\n        align-items: center;\n        transition: background-color 0.2s ease;\n    }\n    \n    .item:hover {\n        background-color: #fafafa;\n    }\n    \n    .item-name {\n        font-weight: 500;\n        color: #555;\n        font-size: 0.9rem;\n    }\n    \n    .item-code {\n        font-family: 'Courier New', monospace;\n        background: #f2f2f2;\n        padding: 0.15rem 0.4rem;\n        border-radius: 3px;\n        font-size: 0.75rem;\n        margin-top: 0.3rem;\n        display: inline-block;\n        color: #777;\n    }\n\n    .item-details {\n        font-size: 0.75rem;\n        color: #888;\n        margin-top: 0.2rem;\n        font-style: italic;\n    }\n    \n    .original-price {\n        text-decoration: line-through;\n        color: #aaa;\n        font-size: 0.85rem;\n    }\n    \n    .discount {\n        color: #b66;\n        font-weight: 500;\n        font-size: 0.85rem;\n    }\n    \n    .final-price {\n        color: #6b8b6b;\n        font-weight: 600;\n        font-size: 0.95rem;\n    }\n    \n    .special-order {\n        background: #fefcf8;\n        border-left: 3px solid #d4c4a8;\n    }\n    \n    .category-subtotal {\n        background: #fafafa;\n        padding: 0.8rem 1.2rem;\n        border-top: 2px solid #e5e5e5;\n        display: flex;\n        justify-content: space-between;\n        font-weight: 600;\n        color: #555;\n        font-size: 0.95rem;\n    }\n</style>",
      "chatHistory": [
        {
          "role": "assistant",
          "content": "I've created an initial visualization based on your document. How would you like me to modify it?"
        },
        {
          "role": "user",
          "content": "make the colors less bold.  dont need order info or customer info\n\nthe line by line breakdown is good"
        },
        {
          "role": "assistant",
          "content": "I've updated the visualization. What else would you like to change?"
        },
        {
          "role": "user",
          "content": "give room subtotals and summary by room,  also dont need payment and amount due"
        },
        {
          "role": "assistant",
          "content": "I've updated the visualization. What else would you like to change?"
        },
        {
          "role": "user",
          "content": "put the order summary at the top"
        },
        {
          "role": "assistant",
          "content": "I've updated the visualization. What else would you like to change?"
        },
        {
          "role": "user",
          "content": "have the order summary with the rooms be a bar chart"
        },
        {
          "role": "assistant",
          "content": "I've updated the visualization. What else would you like to change?"
        },
        {
          "role": "user",
          "content": "move the turkish towels toa new room called bathroom"
        },
        {
          "role": "assistant",
          "content": "I've updated the visualization. What else would you like to change?"
        },
        {
          "role": "user",
          "content": "other items should come last on the categories"
        },
        {
          "role": "assistant",
          "content": "I've updated the visualization. What else would you like to change?"
        },
        {
          "role": "user",
          "content": "it should be last in the bar chart too.  same order as rooms"
        },
        {
          "role": "assistant",
          "content": "I've updated the visualization. What else would you like to change?"
        },
        {
          "role": "user",
          "content": "dont put descriptive info like colors in the same col as original price and sale amount.\n\nyou can put that info in smaller font under the item info"
        },
        {
          "role": "assistant",
          "content": "I've updated the visualization. What else would you like to change?"
        }
      ]
    },
    {
      "id": "1767320166172-jpc1v10",
      "originalName": "anika_schedule_spring_2026.txt",
      "displayName": "Anika's Class Schedule - Spring 2026",
      "fileType": "schedule",
      "importedAt": "2026-01-02T02:16:06.173Z",
      "filePath": "1767320166172-jpc1v10.txt",
